{
  "name": "validate_rule_filename.json",
  "description": "Validates that rule filenames conform to the rule_filename.json standard.",
  "instructions": "Execute the purpose of `validate_rule_filename.json` using the schema-defined structure and rules.",
  "schema": {
    "inputs": {
      "type": "object",
      "properties": {
        "filenames": {
          "type": "array",
          "items": {
            "type": "string"
          }
        }
      },
      "required": [
        "filenames"
      ]
    },
    "outputs": {
      "type": "object",
      "properties": {
        "results": {
          "type": "array",
          "items": {
            "type": "object",
            "properties": {
              "filename": {
                "type": "string"
              },
              "valid": {
                "type": "boolean"
              },
              "errors": {
                "type": "array",
                "items": {
                  "type": "string"
                }
              }
            },
            "required": [
              "filename",
              "valid",
              "errors"
            ]
          }
        }
      },
      "required": [
        "results"
      ]
    }
  },
  "example_input": {
    "filenames": [
      "ENF-R001.json",
      "FRM-R004.json",
      "VAL-XYZ.json"
    ]
  },
  "example_output": {
    "results": [
      {
        "filename": "ENF-R001.json",
        "valid": true,
        "errors": []
      },
      {
        "filename": "FRM-R004.json",
        "valid": true,
        "errors": []
      },
      {
        "filename": "VAL-XYZ.json",
        "valid": false,
        "errors": [
          "invalid rule ID format"
        ]
      }
    ]
  }
}